{
    "$schema": "http://json-schema.org/draft-07/schema#",
    "$id": "https://www.cjf.jus.br/cej/schemas/documento/1.0",
    "title": "Documento do acervo",
    "description": "Um documento (PDF) do acervo do CIn. Diferente do cej_site (Opção A, arquivo no portal do CJF), o cin_site tem custódia própria dos PDFs — url aponta para /assets/notas-tecnicas/ dentro do próprio site.",
    "version": "1.0",
    "type": "object",
    "required": ["id", "serie", "titulo", "descricao", "autor", "ano", "url", "capa"],
    "additionalProperties": false,
    "properties": {
        "id": {
            "type": "string",
            "pattern": "^[a-z0-9][a-z0-9/-]*$",
            "description": "Identificador estável derivado do caminho do arquivo no portal (serie/segmento)."
        },
        "serie": {
            "type": "string",
            "pattern": "^[a-z0-9-]+$",
            "description": "Slug da série, correspondente a uma entrada de 'series' no snapshot."
        },
        "titulo": {
            "type": "string",
            "minLength": 1
        },
        "descricao": {
            "type": "string"
        },
        "autor": {
            "type": ["string", "null"],
            "description": "Extraído da descrição quando segue a convenção 'texto – Autor'."
        },
        "ano": {
            "type": ["integer", "null"],
            "minimum": 1900,
            "maximum": 2100,
            "description": "Ano de publicação extraído do título ou da descrição."
        },
        "url": {
            "type": "string",
            "pattern": "^(https://|/)",
            "description": "Caminho interno (custódia própria, ex.: /assets/notas-tecnicas/nt-2018-18.pdf) ou link direto no portal do CJF. Somente HTTPS ou caminho interno — bloqueia URIs javascript:."
        },
        "capa": {
            "type": ["string", "null"],
            "pattern": "^(https://|/)",
            "description": "Imagem de capa, própria ou no portal do CJF, quando disponível."
        }
    }
}
